{
  "$schema": "http://json-schema.org/draft-07/schema#",
  "$id": "https://withmarble.com/schema/content.schema.json",
  "title": "Marble Topic Content",
  "description": "The teaching + assessment 'flesh' layered on top of a taxonomy micro-topic (the 'skeleton'). One file per topic id. Generated by an LLM grounded in the taxonomy fields + OER, then human-reviewed. Layers cleanly on top of the ODbL/CC-BY-SA taxonomy.",
  "type": "object",
  "required": ["topicId", "name", "subject", "ageRange", "parent", "student", "assessment", "provenance", "license"],
  "additionalProperties": false,
  "properties": {
    "topicId": { "type": "string", "pattern": "^mt_", "description": "Foreign key into data/topics.json." },
    "name": { "type": "string" },
    "subject": { "type": "string" },
    "domain": { "type": "string" },
    "ageRange": { "type": "array", "items": { "type": "integer" }, "minItems": 2, "maxItems": 2 },
    "standards": { "type": "array", "items": { "type": "string" }, "description": "Copied from the topic — the authoritative anchor for accuracy review." },
    "prerequisites": { "type": "array", "items": { "type": "string" }, "description": "Hard-prerequisite topic ids, from the dependency graph." },

    "parent": {
      "type": "object",
      "description": "Parent-app content: orientation and coaching, not kid-facing.",
      "required": ["whyItMatters", "howToTeach"],
      "properties": {
        "whyItMatters": { "type": "string" },
        "howToTeach": { "type": "string" },
        "watchFor": { "type": "array", "items": { "type": "string" }, "description": "Common misconceptions / error patterns to catch." },
        "tryAtHome": { "type": "array", "items": { "type": "string" } }
      }
    },

    "student": {
      "type": "object",
      "description": "Kid-facing teaching content.",
      "required": ["intro"],
      "properties": {
        "intro": { "type": "string" },
        "readingLevelAge": { "type": "integer" },
        "examples": {
          "type": "array",
          "items": {
            "type": "object",
            "required": ["show"],
            "properties": {
              "show": { "type": "string" },
              "say": { "type": "string" }
            }
          }
        }
      }
    },

    "practice": {
      "type": "object",
      "description": "Drill items. Either code-generated (preferred where possible — answers correct by construction) or a static bank.",
      "properties": {
        "generator": { "type": ["string", "null"], "description": "Key into scripts/generators.mjs GENERATORS. Answers computed by code, never by a model." },
        "count": { "type": "integer" },
        "items": { "type": "array", "items": { "type": "object" }, "description": "Static fallback items when no generator applies." }
      }
    },

    "assessment": {
      "type": "object",
      "required": ["masteryCriteria", "items"],
      "properties": {
        "masteryCriteria": { "type": "array", "items": { "type": "string" }, "description": "Copied/derived from the topic's evidence[] — the definition of done." },
        "items": {
          "type": "array",
          "items": {
            "type": "object",
            "required": ["id", "kind", "prompt", "evidenceRef"],
            "properties": {
              "id": { "type": "string" },
              "kind": { "type": "string", "enum": ["numeric", "mcq", "constructed"], "description": "numeric/mcq auto-grade; constructed needs a rubric judge (parent checkbox or LLM-as-judge)." },
              "prompt": { "type": "string" },
              "generator": { "type": ["string", "null"] },
              "choices": { "type": "array", "items": { "type": "string" } },
              "answerIndex": { "type": "integer" },
              "answer": {},
              "rubric": { "type": "array", "items": { "type": "string" }, "description": "For constructed items: checkable criteria derived from evidence, given to the judge." },
              "evidenceRef": { "type": "integer", "description": "Index into the topic's evidence[] this item tests." }
            }
          }
        }
      }
    },

    "provenance": {
      "type": "object",
      "required": ["generatedBy", "reviewed"],
      "description": "Accuracy audit trail. Nothing ships to a child with reviewed:false.",
      "properties": {
        "generatedBy": { "type": "string" },
        "grounding": {
          "type": "array",
          "description": "OER / authoritative sources the generator was grounded in (RAG). verified=true only once actually fetched and checked.",
          "items": {
            "type": "object",
            "properties": {
              "title": { "type": "string" },
              "url": { "type": "string" },
              "license": { "type": "string" },
              "verified": { "type": "boolean" }
            }
          }
        },
        "verification": { "type": "array", "items": { "type": "string" }, "description": "Automated checks that passed (e.g. 'answers code-checked', 'facts cross-checked vs standard')." },
        "reviewed": { "type": "boolean" },
        "reviewer": { "type": ["string", "null"] }
      }
    },

    "license": { "type": "string", "description": "e.g. CC-BY-SA-4.0 — inherits the taxonomy's share-alike spirit." }
  }
}
